tunableop_results0.csv
Validator,PT_VERSION,2.5.1
Validator,ROCM_VERSION,6.2.0.0-66-98a50c5
Validator,HIPBLASLT_VERSION,800-50015815
Validator,GCN_ARCH_NAME,gfx1100
Validator,ROCBLAS_VERSION,4.2.0-54f305c1-dirty
GemmTunableOp_float_TN,tn_384_12_384,Gemm_Rocblas_1140853253,0.0118368
GemmTunableOp_float_TN,tn_384_200_384,Gemm_Rocblas_1140853097,0.0147045
GemmTunableOp_float_TN,tn_384_7840_1536,Default,0.341632
GemmTunableOp_float_TN,tn_384_200_1536,Gemm_Rocblas_1140853248,0.0342335
GemmTunableOp_float_TN,tn_384_208_384,Gemm_Rocblas_1140853316,0.0146653
GemmTunableOp_float_TN,tn_1536_580_384,Gemm_Rocblas_1140853036,0.0405995
GemmTunableOp_float_TN,tn_384_7_1536,Gemm_Rocblas_1140853250,0.0201442
GemmTunableOp_float_TN,tn_384_740_1536,Gemm_Rocblas_1140853098,0.0671649
GemmTunableOp_float_TN,tn_384_500_384,Gemm_Rocblas_1140853097,0.0173845
GemmTunableOp_float_TN,tn_1536_408_384,Gemm_Rocblas_1140853066,0.0300991
GemmTunableOp_float_TN,tn_384_7680_384,Gemm_Rocblas_1140853048,0.0961267
GemmTunableOp_float_TN,tn_1536_636_384,Gemm_Rocblas_1140853028,0.0438739
GemmTunableOp_float_TN,tn_384_5664_1536,Gemm_Rocblas_1140853328,0.254645
GemmTunableOp_float_TN,tn_1536_600_384,Gemm_Rocblas_1140853073,0.0417279
GemmTunableOp_float_TN,tn_384_6400_1536,Default,0.328306
GemmTunableOp_float_TN,tn_1536_652_384,Gemm_Rocblas_1140853045,0.0403991
GemmTunableOp_float_TN,tn_384_136_1536,Gemm_Rocblas_1140853191,0.0289137
GemmTunableOp_float_TN,tn_1536_7808_384,Default,0.361374
GemmTunableOp_float_TN,tn_384_600_1536,Gemm_Rocblas_1140853174,0.0605453
GemmTunableOp_float_TN,tn_384_648_1536,Gemm_Rocblas_1140853174,0.0600305
GemmTunableOp_float_TN,tn_1536_8192_384,Gemm_Rocblas_1140853331,0.349751
GemmTunableOp_float_TN,tn_384_180_1536,Gemm_Rocblas_1140853191,0.0301218
GemmTunableOp_float_TN,tn_1536_7776_384,Gemm_Rocblas_1140853331,0.368573
GemmTunableOp_float_TN,tn_384_288_1536,Gemm_Rocblas_1140853191,0.0408159
GemmTunableOp_float_TN,tn_384_7520_384,Gemm_Rocblas_1140853048,0.0995188
GemmTunableOp_float_TN,tn_384_7200_1536,Default,0.356403
GemmTunableOp_float_TN,tn_384_676_1536,Gemm_Rocblas_1140853182,0.0605433
GemmTunableOp_float_TN,tn_1536_40_384,Gemm_Rocblas_1140853324,0.0154561
GemmTunableOp_float_TN,tn_384_7808_384,Gemm_Rocblas_1140853047,0.0974055
GemmTunableOp_float_TN,tn_384_740_384,Gemm_Rocblas_1140853098,0.0211954
GemmTunableOp_float_TN,tn_384_6720_1536,Gemm_Rocblas_1140853073,0.310501
GemmTunableOp_float_TN,tn_384_600_384,Gemm_Rocblas_1140853316,0.0205618
GemmTunableOp_float_TN,tn_384_1012_1536,Gemm_Rocblas_1140853130,0.0706081
GemmTunableOp_float_TN,tn_384_6496_384,Gemm_Rocblas_1140853064,0.0914975
GemmTunableOp_float_TN,tn_1536_8160_384,Default,0.347333
GemmTunableOp_float_TN,tn_384_744_1536,Gemm_Rocblas_1140853130,0.0668413
GemmTunableOp_float_TN,tn_1536_6464_384,Gemm_Rocblas_1140853331,0.297795
GemmTunableOp_float_TN,tn_384_568_1536,Gemm_Rocblas_1140853156,0.0632237
GemmTunableOp_float_TN,tn_1536_812_384,Default,0.0492912
GemmTunableOp_float_TN,tn_384_7840_384,Gemm_Rocblas_1140853038,0.10102
GemmTunableOp_float_TN,tn_384_96_1536,Gemm_Rocblas_1140853181,0.0257106
GemmTunableOp_float_TN,tn_384_640_384,Gemm_Rocblas_1140853098,0.0202198
GemmTunableOp_float_TN,tn_384_644_384,Gemm_Rocblas_1140853120,0.020835
GemmTunableOp_float_TN,tn_384_7328_1536,Default,0.352031
GemmTunableOp_float_TN,tn_384_48_1536,Gemm_Rocblas_1140853253,0.0224449
GemmTunableOp_float_TN,tn_1536_648_384,Gemm_Rocblas_1140853045,0.0403795
GemmTunableOp_float_TN,tn_1536_7_384,Gemm_Rocblas_1140853266,0.0151221
GemmTunableOp_float_TN,tn_1536_6400_384,Gemm_Rocblas_1140853331,0.290031
GemmTunableOp_float_TN,tn_384_6592_384,Gemm_Rocblas_1140853064,0.0880527
GemmTunableOp_float_TN,tn_384_676_384,Gemm_Rocblas_1140853098,0.0211562
GemmTunableOp_float_TN,tn_1536_7200_384,Gemm_Rocblas_1140853290,0.343631
GemmTunableOp_float_TN,tn_384_7360_1536,Default,0.357187
GemmTunableOp_float_TN,tn_384_672_1536,Gemm_Rocblas_1140853098,0.0650625
GemmTunableOp_float_TN,tn_384_852_1536,Gemm_Rocblas_1140853108,0.0681918
GemmTunableOp_float_TN,tn_1536_744_384,Gemm_Rocblas_1140853028,0.0463292
GemmTunableOp_float_TN,tn_384_7392_1536,Default,0.353874
GemmTunableOp_float_TN,tn_384_6592_1536,Gemm_Rocblas_1140853073,0.315282
GemmTunableOp_float_TN,tn_1536_128_384,Gemm_Rocblas_1140853322,0.0168389
GemmTunableOp_float_TN,tn_1536_176_384,Gemm_Rocblas_1140853120,0.020835
GemmTunableOp_float_TN,tn_384_620_384,Gemm_Rocblas_1140853097,0.0206158
GemmTunableOp_float_TN,tn_1536_728_384,Gemm_Rocblas_1140853028,0.0463167
GemmTunableOp_float_TN,tn_384_64_1536,Gemm_Rocblas_1140853171,0.0234727
GemmTunableOp_float_TN,tn_1536_400_384,Gemm_Rocblas_1140853066,0.0295214
GemmTunableOp_float_TN,tn_384_212_1536,Gemm_Rocblas_1140853265,0.0342011
GemmTunableOp_float_TN,tn_384_272_384,Gemm_Rocblas_1140853316,0.0158865
GemmTunableOp_float_TN,tn_384_6336_384,Gemm_Rocblas_1140853330,0.0895696
GemmTunableOp_float_TN,tn_1536_340_384,Gemm_Rocblas_1140853122,0.0282194
GemmTunableOp_float_TN,tn_1536_6720_384,Gemm_Rocblas_1140853149,0.300424
GemmTunableOp_float_TN,tn_384_7520_1536,Default,0.359442
GemmTunableOp_float_TN,tn_384_6048_1536,Gemm_Rocblas_1140853328,0.25889
GemmTunableOp_float_TN,tn_384_624_384,Gemm_Rocblas_1140853097,0.0206082
GemmTunableOp_float_TN,tn_384_6272_1536,Gemm_Rocblas_1140853036,0.330491
GemmTunableOp_float_TN,tn_384_128_1536,Gemm_Rocblas_1140853265,0.024831
GemmTunableOp_float_TN,tn_384_9_1536,Gemm_Rocblas_1140853250,0.020231
GemmTunableOp_float_TN,tn_384_6528_1536,Gemm_Rocblas_1140853036,0.335301
GemmTunableOp_float_TN,tn_1536_708_384,Gemm_Rocblas_1140853053,0.0449559
GemmTunableOp_float_TN,tn_384_7104_384,Gemm_Rocblas_1140853073,0.0929091
GemmTunableOp_float_TN,tn_1536_308_384,Gemm_Rocblas_1140853145,0.028215
GemmTunableOp_float_TN,tn_384_4_1536,Gemm_Rocblas_1140853250,0.0200302
GemmTunableOp_float_TN,tn_1536_6496_384,Gemm_Rocblas_1140853331,0.297949
GemmTunableOp_float_TN,tn_384_628_1536,Gemm_Rocblas_1140853170,0.0605972
GemmTunableOp_float_TN,tn_1536_392_384,Gemm_Rocblas_1140853066,0.0296766
GemmTunableOp_float_TN,tn_1536_6624_384,Gemm_Rocblas_1140853291,0.30628
GemmTunableOp_float_TN,tn_1536_732_384,Gemm_Rocblas_1140853073,0.0415479
GemmTunableOp_float_TN,tn_1536_484_384,Gemm_Rocblas_1140853066,0.0330895
GemmTunableOp_float_TN,tn_1536_620_384,Gemm_Rocblas_1140853064,0.0404291
GemmTunableOp_float_TN,tn_1536_280_384,Gemm_Rocblas_1140853157,0.027913
GemmTunableOp_float_TN,tn_384_7616_1536,Default,0.360258
GemmTunableOp_float_TN,tn_384_7744_1536,Default,0.366657
GemmTunableOp_float_TN,tn_384_880_384,Gemm_Rocblas_1140853100,0.0216566
GemmTunableOp_float_TN,tn_384_648_384,Gemm_Rocblas_1140853120,0.020833
GemmTunableOp_float_TN,tn_384_176_1536,Gemm_Rocblas_1140853191,0.0299175
GemmTunableOp_float_TN,tn_384_176_384,Gemm_Rocblas_1140853320,0.0146729
GemmTunableOp_float_TN,tn_384_392_384,Gemm_Rocblas_1140853306,0.0170305
GemmTunableOp_float_TN,tn_1536_88_384,Gemm_Rocblas_1140853309,0.0162337
GemmTunableOp_float_TN,tn_384_704_1536,Gemm_Rocblas_1140853098,0.0650885
GemmTunableOp_float_TN,tn_384_212_384,Gemm_Rocblas_1140853316,0.0147237
GemmTunableOp_float_TN,tn_384_7456_384,Gemm_Rocblas_1140853047,0.0988244
GemmTunableOp_float_TN,tn_1536_6176_384,Gemm_Rocblas_1140853331,0.295072
GemmTunableOp_float_TN,tn_1536_212_384,Gemm_Rocblas_1140853322,0.0218434
GemmTunableOp_float_TN,tn_1536_684_384,Gemm_Rocblas_1140853028,0.0454428
GemmTunableOp_float_TN,tn_384_7360_384,Gemm_Rocblas_1140853046,0.0986316
GemmTunableOp_float_TN,tn_384_684_384,Gemm_Rocblas_1140853098,0.021167
GemmTunableOp_float_TN,tn_384_7008_384,Gemm_Rocblas_1140853073,0.0951692
GemmTunableOp_float_TN,tn_384_188_1536,Gemm_Rocblas_1140853191,0.0299479
GemmTunableOp_float_TN,tn_384_728_1536,Gemm_Rocblas_1140853098,0.0653857
GemmTunableOp_float_TN,tn_384_6944_384,Gemm_Rocblas_1140853073,0.0910883
GemmTunableOp_float_TN,tn_384_188_384,Gemm_Rocblas_1140853316,0.0147017
GemmTunableOp_float_TN,tn_1536_360_384,Gemm_Rocblas_1140853100,0.0284038
GemmTunableOp_float_TN,tn_384_820_384,Gemm_Rocblas_1140853100,0.0219658
GemmTunableOp_float_TN,tn_1536_184_384,Gemm_Rocblas_1140853143,0.0208582
GemmTunableOp_float_TN,tn_384_436_384,Gemm_Rocblas_1140853306,0.0172469
GemmTunableOp_float_TN,tn_1536_224_384,Gemm_Rocblas_1140853100,0.0219609
GemmTunableOp_float_TN,tn_384_172_1536,Gemm_Rocblas_1140853191,0.029915
GemmTunableOp_float_TN,tn_1536_536_384,Gemm_Rocblas_1140853036,0.0414099
GemmTunableOp_float_TN,tn_384_236_384,Gemm_Rocblas_1140853308,0.0150169
GemmTunableOp_float_TN,tn_384_296_1536,Gemm_Rocblas_1140853191,0.0401271
GemmTunableOp_float_TN,tn_384_6528_384,Gemm_Rocblas_1140853073,0.0923651
GemmTunableOp_float_TN,tn_384_408_1536,Gemm_Rocblas_1140853108,0.0463304
GemmTunableOp_float_TN,tn_1536_6112_384,Gemm_Rocblas_1140853290,0.279985
GemmTunableOp_float_TN,tn_1536_568_384,Gemm_Rocblas_1140853036,0.0424163
GemmTunableOp_float_TN,tn_384_320_384,Gemm_Rocblas_1140853316,0.0156321
GemmTunableOp_float_TN,tn_384_7424_1536,Default,0.349905
GemmTunableOp_float_TN,tn_1536_7008_384,Default,0.308764
GemmTunableOp_float_TN,tn_384_8096_384,Gemm_Rocblas_1140853038,0.103851
GemmTunableOp_float_TN,tn_384_520_384,Gemm_Rocblas_1140853309,0.0203802
GemmTunableOp_float_TN,tn_384_7232_1536,Default,0.358311
GemmTunableOp_float_TN,tn_384_492_384,Gemm_Rocblas_1140853306,0.0173341
GemmTunableOp_float_TN,tn_384_576_1536,Gemm_Rocblas_1140853156,0.0629665
GemmTunableOp_float_TN,tn_384_6624_384,Gemm_Rocblas_1140853064,0.0939611
GemmTunableOp_float_TN,tn_384_6176_1536,Gemm_Rocblas_1140853036,0.338405
GemmTunableOp_float_TN,tn_384_604_1536,Gemm_Rocblas_1140853119,0.0636333
GemmTunableOp_float_TN,tn_384_16_384,Gemm_Rocblas_1140853249,0.0115117
GemmTunableOp_float_TN,tn_1536_976_384,Gemm_Rocblas_1140853030,0.0571053
GemmTunableOp_float_TN,tn_384_568_384,Gemm_Rocblas_1140853309,0.0205262
GemmTunableOp_float_TN,tn_384_976_384,Gemm_Rocblas_1140853157,0.021915
GemmTunableOp_float_TN,tn_384_436_1536,Gemm_Rocblas_1140853108,0.0479924
GemmTunableOp_float_TN,tn_384_880_1536,Gemm_Rocblas_1140853108,0.0680814
GemmTunableOp_float_TN,tn_384_6240_384,Gemm_Rocblas_1140853330,0.0939043
GemmTunableOp_float_TN,tn_384_256_1536,Gemm_Rocblas_1140853156,0.0381851
GemmTunableOp_float_TN,tn_384_6112_1536,Gemm_Rocblas_1140853328,0.261508
GemmTunableOp_float_TN,tn_1536_6_384,Gemm_Rocblas_1140853253,0.0150101
GemmTunableOp_float_TN,tn_384_936_384,Gemm_Rocblas_1140853100,0.0217578
GemmTunableOp_float_TN,tn_384_404_384,Gemm_Rocblas_1140853306,0.0171033
GemmTunableOp_float_TN,tn_384_5216_1536,Gemm_Rocblas_1140853038,0.262992
GemmTunableOp_float_TN,tn_1536_572_384,Gemm_Rocblas_1140853123,0.0424783
GemmTunableOp_float_TN,tn_1536_768_384,Gemm_Rocblas_1140853053,0.042882
GemmTunableOp_float_TN,tn_384_688_1536,Gemm_Rocblas_1140853098,0.0658061
GemmTunableOp_float_TN,tn_384_8000_384,Gemm_Rocblas_1140853047,0.1029
GemmTunableOp_float_TN,tn_384_680_1536,Gemm_Rocblas_1140853182,0.0600729
GemmTunableOp_float_TN,tn_1536_436_384,Gemm_Rocblas_1140853036,0.0310467
GemmTunableOp_float_TN,tn_384_184_384,Gemm_Rocblas_1140853316,0.0146777
GemmTunableOp_float_TN,tn_384_344_1536,Gemm_Rocblas_1140853309,0.0429863
GemmTunableOp_float_TN,tn_384_488_1536,Gemm_Rocblas_1140853180,0.0491756
GemmTunableOp_float_TN,tn_384_45_384,Gemm_Rocblas_1140853266,0.0136957
GemmTunableOp_float_TN,tn_1536_868_384,Gemm_Rocblas_1140853064,0.0499152
GemmTunableOp_float_TN,tn_384_588_1536,Gemm_Rocblas_1140853097,0.0633313
GemmTunableOp_float_TN,tn_384_6240_1536,Gemm_Rocblas_1140853036,0.33637
GemmTunableOp_float_TN,tn_384_408_384,Gemm_Rocblas_1140853306,0.0171821
GemmTunableOp_float_TN,tn_384_540_1536,Gemm_Rocblas_1140853170,0.0577576
GemmTunableOp_float_TN,tn_384_108_384,Gemm_Rocblas_1140853215,0.0136769
GemmTunableOp_float_TN,tn_384_672_384,Gemm_Rocblas_1140853120,0.020859
GemmTunableOp_float_TN,tn_1536_624_384,Gemm_Rocblas_1140853028,0.0440115
GemmTunableOp_float_TN,tn_1536_8000_384,Default,0.340111
GemmTunableOp_float_TN,tn_1536_592_384,Gemm_Rocblas_1140853036,0.0426015
GemmTunableOp_float_TN,tn_384_508_384,Gemm_Rocblas_1140853119,0.0174273
GemmTunableOp_float_TN,tn_384_952_384,Gemm_Rocblas_1140853100,0.0218586
GemmTunableOp_float_TN,tn_384_360_384,Gemm_Rocblas_1140853316,0.0156593
GemmTunableOp_float_TN,tn_1536_464_384,Gemm_Rocblas_1140853284,0.0308067
GemmTunableOp_float_TN,tn_384_804_1536,Gemm_Rocblas_1140853108,0.0661521
GemmTunableOp_float_TN,tn_384_644_1536,Gemm_Rocblas_1140853193,0.0640425
GemmTunableOp_float_TN,tn_1536_604_384,Gemm_Rocblas_1140853028,0.0430167
GemmTunableOp_float_TN,tn_384_8_1536,Gemm_Rocblas_1140853250,0.0202786
GemmTunableOp_float_TN,tn_1536_1024_384,Gemm_Rocblas_1140853030,0.054108
GemmTunableOp_float_TN,tn_384_2_384,Gemm_Rocblas_1140853253,0.0128073
GemmTunableOp_float_TN,tn_384_280_1536,Gemm_Rocblas_1140853181,0.0368155
GemmTunableOp_float_TN,tn_1536_2_384,Gemm_Rocblas_1140853266,0.0154497
GemmTunableOp_float_TN,tn_384_244_1536,Gemm_Rocblas_1140853265,0.0346503
GemmTunableOp_float_TN,tn_384_968_384,Gemm_Rocblas_1140853108,0.0218926
GemmTunableOp_float_TN,tn_384_616_1536,Gemm_Rocblas_1140853182,0.0586173
GemmTunableOp_float_TN,tn_384_448_1536,Gemm_Rocblas_1140853108,0.0466368
GemmTunableOp_float_TN,tn_1536_232_384,Gemm_Rocblas_1140853108,0.0223341
GemmTunableOp_float_TN,tn_1536_28_384,Gemm_Rocblas_1140853303,0.0142061
GemmTunableOp_float_TN,tn_1536_628_384,Gemm_Rocblas_1140853036,0.0414231
GemmTunableOp_float_TN,tn_1536_452_384,Gemm_Rocblas_1140853328,0.0314679
GemmTunableOp_float_TN,tn_384_64_384,Gemm_Rocblas_1140853262,0.0126725
GemmTunableOp_float_TN,tn_384_812_1536,Gemm_Rocblas_1140853108,0.0664933
GemmTunableOp_float_TN,tn_1536_220_384,Gemm_Rocblas_1140853108,0.0219902
GemmTunableOp_float_TN,tn_384_840_384,Gemm_Rocblas_1140853145,0.0216858
GemmTunableOp_float_TN,tn_384_452_384,Gemm_Rocblas_1140853306,0.0171917
GemmTunableOp_float_TN,tn_384_628_384,Gemm_Rocblas_1140853119,0.0206033
GemmTunableOp_float_TN,tn_384_5_384,Gemm_Rocblas_1140853249,0.0129197
GemmTunableOp_float_TN,tn_384_8192_1536,Gemm_Rocblas_1140853060,0.352448
GemmTunableOp_float_TN,tn_384_472_384,Gemm_Rocblas_1140853119,0.0173309
GemmTunableOp_float_TN,tn_1536_56_384,Gemm_Rocblas_1140853303,0.0154453
GemmTunableOp_float_TN,tn_1536_180_384,Gemm_Rocblas_1140853120,0.020831
GemmTunableOp_float_TN,tn_384_240_1536,Gemm_Rocblas_1140853265,0.0344283
GemmTunableOp_float_TN,tn_384_584_1536,Gemm_Rocblas_1140853174,0.0629441
GemmTunableOp_float_TN,tn_384_808_1536,Gemm_Rocblas_1140853130,0.0664817
GemmTunableOp_float_TN,tn_384_420_1536,Gemm_Rocblas_1140853316,0.0495851
GemmTunableOp_float_TN,tn_384_7232_384,Gemm_Rocblas_1140853043,0.100509
GemmTunableOp_float_TN,tn_384_272_1536,Gemm_Rocblas_1140853181,0.0391287
GemmTunableOp_float_TN,tn_384_684_1536,Gemm_Rocblas_1140853098,0.0662453
GemmTunableOp_float_TN,tn_1536_576_384,Gemm_Rocblas_1140853327,0.0410867
GemmTunableOp_float_TN,tn_1536_372_384,Gemm_Rocblas_1140853108,0.0287646
GemmTunableOp_float_TN,tn_1536_7232_384,Gemm_Rocblas_1140853290,0.343946
GemmTunableOp_float_TN,tn_384_336_1536,Gemm_Rocblas_1140853170,0.0425943
GemmTunableOp_float_TN,tn_1536_348_384,Gemm_Rocblas_1140853108,0.0284453
GemmTunableOp_float_TN,tn_1536_70_384,Gemm_Rocblas_1140853317,0.0184318
GemmTunableOp_float_TN,tn_1536_4928_384,Gemm_Rocblas_1140853290,0.230599
GemmTunableOp_float_TN,tn_384_780_384,Gemm_Rocblas_1140853100,0.0217154
GemmTunableOp_float_TN,tn_1536_6048_384,Gemm_Rocblas_1140853052,0.281676
GemmTunableOp_float_TN,tn_1536_7712_384,Default,0.36453
GemmTunableOp_float_TN,tn_384_180_384,Gemm_Rocblas_1140853142,0.0146653
GemmTunableOp_float_TN,tn_1536_528_384,Gemm_Rocblas_1140853036,0.0420391
GemmTunableOp_float_TN,tn_1536_268_384,Gemm_Rocblas_1140853157,0.0279214
GemmTunableOp_float_TN,tn_384_384_384,Gemm_Rocblas_1140853097,0.0154529
GemmTunableOp_float_TN,tn_1536_7904_384,Default,0.336156
GemmTunableOp_float_TN,tn_384_6368_384,Gemm_Rocblas_1140853064,0.0902703
GemmTunableOp_float_TN,tn_384_692_384,Gemm_Rocblas_1140853120,0.0210266
GemmTunableOp_float_TN,tn_384_352_384,Gemm_Rocblas_1140853097,0.0153913
GemmTunableOp_float_TN,tn_384_348_384,Gemm_Rocblas_1140853316,0.0156909
GemmTunableOp_float_TN,tn_384_6752_384,Gemm_Rocblas_1140853073,0.0938911
GemmTunableOp_float_TN,tn_1536_480_384,Gemm_Rocblas_1140853284,0.0309379
GemmTunableOp_float_TN,tn_1536_852_384,Gemm_Rocblas_1140853030,0.0531716
GemmTunableOp_float_TN,tn_384_312_1536,Gemm_Rocblas_1140853181,0.0407723
GemmTunableOp_float_TN,tn_384_7136_384,Gemm_Rocblas_1140853073,0.0960069
GemmTunableOp_float_TN,tn_384_636_384,Gemm_Rocblas_1140853097,0.020623
GemmTunableOp_float_TN,tn_384_232_1536,Gemm_Rocblas_1140853252,0.0346158
GemmTunableOp_float_TN,tn_1536_244_384,Gemm_Rocblas_1140853100,0.022441
GemmTunableOp_float_TN,tn_1536_440_384,Gemm_Rocblas_1140853064,0.030877
GemmTunableOp_float_TN,tn_384_7776_384,Gemm_Rocblas_1140853046,0.101615
GemmTunableOp_float_TN,tn_384_696_1536,Gemm_Rocblas_1140853098,0.0659973
GemmTunableOp_float_TN,tn_384_372_384,Gemm_Rocblas_1140853097,0.0157065
GemmTunableOp_float_TN,tn_384_356_1536,Gemm_Rocblas_1140853316,0.042992
GemmTunableOp_float_TN,tn_384_444_1536,Gemm_Rocblas_1140853108,0.0471624
GemmTunableOp_float_TN,tn_384_68_1536,Gemm_Rocblas_1140853251,0.0256029
GemmTunableOp_float_TN,tn_1536_700_384,Gemm_Rocblas_1140853064,0.0419455
GemmTunableOp_float_TN,tn_384_680_384,Gemm_Rocblas_1140853098,0.0211346
GemmTunableOp_float_TN,tn_384_700_1536,Gemm_Rocblas_1140853143,0.0662766
GemmTunableOp_float_TN,tn_384_344_384,Gemm_Rocblas_1140853097,0.0157049
GemmTunableOp_float_TN,tn_384_788_384,Gemm_Rocblas_1140853100,0.0217146
GemmTunableOp_float_TN,tn_384_7712_384,Gemm_Rocblas_1140853046,0.101201
GemmTunableOp_float_TN,tn_1536_60_384,Gemm_Rocblas_1140853151,0.0156753
GemmTunableOp_float_TN,tn_1536_560_384,Gemm_Rocblas_1140853036,0.0422224
GemmTunableOp_float_TN,tn_384_300_384,Gemm_Rocblas_1140853316,0.0158693
GemmTunableOp_float_TN,tn_1536_6240_384,Gemm_Rocblas_1140853331,0.294578
GemmTunableOp_float_TN,tn_1536_336_384,Gemm_Rocblas_1140853108,0.0281066
GemmTunableOp_float_TN,tn_1536_260_384,Gemm_Rocblas_1140853157,0.0279058
GemmTunableOp_float_TN,tn_1536_7552_384,Gemm_Rocblas_1140853331,0.344497
GemmTunableOp_float_TN,tn_384_460_1536,Gemm_Rocblas_1140853100,0.0480952
GemmTunableOp_float_TN,tn_384_732_1536,Gemm_Rocblas_1140853098,0.0654465
GemmTunableOp_float_TN,tn_384_144_384,Gemm_Rocblas_1140853197,0.0146621
GemmTunableOp_float_TN,tn_1536_7392_384,Gemm_Rocblas_1140853331,0.345603
GemmTunableOp_float_TN,tn_1536_476_384,Gemm_Rocblas_1140853284,0.0309142
GemmTunableOp_float_TN,tn_384_376_384,Gemm_Rocblas_1140853316,0.0157377
GemmTunableOp_float_TN,tn_384_6400_384,Gemm_Rocblas_1140853073,0.0895363
GemmTunableOp_float_TN,tn_384_468_384,Gemm_Rocblas_1140853306,0.0172993
GemmTunableOp_float_TN,tn_384_584_384,Gemm_Rocblas_1140853316,0.0205438
GemmTunableOp_float_TN,tn_384_220_1536,Gemm_Rocblas_1140853248,0.0344462
GemmTunableOp_float_TN,tn_384_288_384,Gemm_Rocblas_1140853316,0.0154417
GemmTunableOp_float_TN,tn_384_552_384,Gemm_Rocblas_1140853316,0.0205078
GemmTunableOp_float_TN,tn_384_516_384,Gemm_Rocblas_1140853316,0.020377
GemmTunableOp_float_TN,tn_1536_508_384,Gemm_Rocblas_1140853284,0.0329235
GemmTunableOp_float_TN,tn_1536_352_384,Gemm_Rocblas_1140853108,0.0283022
GemmTunableOp_float_TN,tn_384_7424_384,Gemm_Rocblas_1140853046,0.0930296
GemmTunableOp_float_TN,tn_384_608_1536,Gemm_Rocblas_1140853097,0.0630153
GemmTunableOp_float_TN,tn_1536_6688_384,Gemm_Rocblas_1140853290,0.30533
GemmTunableOp_float_TN,tn_384_412_1536,Gemm_Rocblas_1140853170,0.0419779
GemmTunableOp_float_TN,tn_1536_156_384,Gemm_Rocblas_1140853316,0.0203597
GemmTunableOp_float_TN,tn_384_7648_1536,Default,0.359609
GemmTunableOp_float_TN,tn_384_556_384,Gemm_Rocblas_1140853097,0.0205902
GemmTunableOp_float_TN,tn_1536_316_384,Gemm_Rocblas_1140853145,0.0283558
GemmTunableOp_float_TN,tn_384_92_384,Gemm_Rocblas_1140853197,0.0128769
GemmTunableOp_float_TN,tn_384_7584_384,Gemm_Rocblas_1140853047,0.099146
GemmTunableOp_float_TN,tn_384_544_384,Gemm_Rocblas_1140853316,0.020019
GemmTunableOp_float_TN,tn_384_548_1536,Gemm_Rocblas_1140853170,0.0611109
GemmTunableOp_float_TN,tn_384_280_384,Gemm_Rocblas_1140853316,0.0158929
GemmTunableOp_float_TN,tn_1536_64_384,Gemm_Rocblas_1140853324,0.0148157
GemmTunableOp_float_TN,tn_1536_288_384,Gemm_Rocblas_1140853157,0.0280366
GemmTunableOp_float_TN,tn_384_396_1536,Gemm_Rocblas_1140853193,0.045942
GemmTunableOp_float_TN,tn_384_6304_1536,Gemm_Rocblas_1140853036,0.313304
GemmTunableOp_float_TN,tn_384_412_384,Gemm_Rocblas_1140853306,0.0172621
GemmTunableOp_float_TN,tn_1536_644_384,Gemm_Rocblas_1140853101,0.044722
GemmTunableOp_float_TN,tn_384_776_384,Gemm_Rocblas_1140853100,0.0217786
GemmTunableOp_float_TN,tn_384_204_384,Gemm_Rocblas_1140853316,0.0146797
GemmTunableOp_float_TN,tn_384_224_1536,Gemm_Rocblas_1140853258,0.0344058
GemmTunableOp_float_TN,tn_1536_5_384,Gemm_Rocblas_1140853253,0.0150729
GemmTunableOp_float_TN,tn_1536_492_384,Gemm_Rocblas_1140853073,0.0307867
GemmTunableOp_float_TN,tn_1536_880_384,Gemm_Rocblas_1140853073,0.0543885
GemmTunableOp_float_TN,tn_1536_380_384,Gemm_Rocblas_1140853108,0.0289286
GemmTunableOp_float_TN,tn_384_428_1536,Gemm_Rocblas_1140853094,0.0449252
GemmTunableOp_float_TN,tn_384_444_384,Gemm_Rocblas_1140853306,0.0172445
GemmTunableOp_float_TN,tn_384_604_384,Gemm_Rocblas_1140853309,0.0205522
GemmTunableOp_float_TN,tn_384_484_384,Gemm_Rocblas_1140853306,0.0172129
GemmTunableOp_float_TN,tn_384_6304_384,Gemm_Rocblas_1140853073,0.0906927
GemmTunableOp_float_TN,tn_384_240_384,Gemm_Rocblas_1140853308,0.0150945
GemmTunableOp_float_TN,tn_384_9_384,Gemm_Rocblas_1140853249,0.0130913
GemmTunableOp_float_TN,tn_384_504_1536,Gemm_Rocblas_1140853180,0.0485768
GemmTunableOp_float_TN,tn_1536_564_384,Gemm_Rocblas_1140853123,0.0428699
GemmTunableOp_float_TN,tn_1536_404_384,Gemm_Rocblas_1140853066,0.0300538
GemmTunableOp_float_TN,tn_1536_248_384,Gemm_Rocblas_1140853100,0.022415
GemmTunableOp_float_TN,tn_384_172_384,Gemm_Rocblas_1140853320,0.0145949
GemmTunableOp_float_TN,tn_384_576_384,Gemm_Rocblas_1140853120,0.0200998
GemmTunableOp_float_TN,tn_384_192_384,Gemm_Rocblas_1140853316,0.0143505
GemmTunableOp_float_TN,tn_384_260_384,Gemm_Rocblas_1140853316,0.0158433
GemmTunableOp_float_TN,tn_1536_12_384,Gemm_Rocblas_1140853249,0.0141963
GemmTunableOp_float_TN,tn_384_7552_384,Gemm_Rocblas_1140853046,0.0966308
GemmTunableOp_float_TN,tn_1536_7040_384,Default,0.309689
GemmTunableOp_float_TN,tn_1536_396_384,Gemm_Rocblas_1140853066,0.0296407
GemmTunableOp_float_TN,tn_1536_540_384,Gemm_Rocblas_1140853036,0.0418711
GemmTunableOp_float_TN,tn_384_36_384,Gemm_Rocblas_1140853260,0.0122813
GemmTunableOp_float_TN,tn_1536_7296_384,Gemm_Rocblas_1140853029,0.341316
GemmTunableOp_float_TN,tn_384_52_1536,Gemm_Rocblas_1140853171,0.0230237
GemmTunableOp_float_TN,tn_384_7264_1536,Default,0.355781
GemmTunableOp_float_TN,tn_384_7264_384,Gemm_Rocblas_1140853046,0.0978048
GemmTunableOp_float_TN,tn_1536_968_384,Gemm_Rocblas_1140853075,0.0562373
GemmTunableOp_float_TN,tn_384_6560_1536,Gemm_Rocblas_1140853036,0.311248
GemmTunableOp_float_TN,tn_1536_236_384,Gemm_Rocblas_1140853100,0.0221578
GemmTunableOp_float_TN,tn_384_328_1536,Gemm_Rocblas_1140853170,0.0421403
GemmTunableOp_float_TN,tn_1536_676_384,Gemm_Rocblas_1140853045,0.0408095
GemmTunableOp_float_TN,tn_384_6976_1536,Default,0.332323
GemmTunableOp_float_TN,tn_1536_6976_384,Default,0.305699
GemmTunableOp_float_TN,tn_384_6272_384,Gemm_Rocblas_1140853330,0.0881495
GemmTunableOp_float_TN,tn_1536_164_384,Gemm_Rocblas_1140853120,0.0207898
GemmTunableOp_float_TN,tn_1536_36_384,Gemm_Rocblas_1140853324,0.0152477
GemmTunableOp_float_TN,tn_384_236_1536,Gemm_Rocblas_1140853265,0.0344043
GemmTunableOp_float_TN,tn_384_104_1536,Gemm_Rocblas_1140853181,0.0246414
GemmTunableOp_float_TN,tn_384_668_384,Gemm_Rocblas_1140853098,0.0208686
GemmTunableOp_float_TN,tn_384_7488_384,Gemm_Rocblas_1140853047,0.0987836
GemmTunableOp_float_TN,tn_384_7936_1536,Default,0.34343
GemmTunableOp_float_TN,tn_384_70_384,Gemm_Rocblas_1140853197,0.0135557
GemmTunableOp_float_TN,tn_384_7168_384,Gemm_Rocblas_1140853064,0.0912488
GemmTunableOp_float_TN,tn_384_248_384,Gemm_Rocblas_1140853308,0.0150153
GemmTunableOp_float_TN,tn_384_516_1536,Gemm_Rocblas_1140853170,0.0569077
GemmTunableOp_float_TN,tn_1536_432_384,Gemm_Rocblas_1140853064,0.0299046
GemmTunableOp_float_TN,tn_1536_16_384,Gemm_Rocblas_1140853249,0.0143109
GemmTunableOp_float_TN,tn_1536_444_384,Gemm_Rocblas_1140853036,0.0314715
GemmTunableOp_float_TN,tn_384_224_384,Gemm_Rocblas_1140853324,0.0145637
GemmTunableOp_float_TN,tn_1536_448_384,Gemm_Rocblas_1140853064,0.0291662
GemmTunableOp_float_TN,tn_384_7616_384,Gemm_Rocblas_1140853047,0.099332
GemmTunableOp_float_TN,tn_1536_668_384,Gemm_Rocblas_1140853028,0.0446631
GemmTunableOp_float_TN,tn_384_7168_1536,Gemm_Rocblas_1140853036,0.348443
GemmTunableOp_float_TN,tn_384_6560_384,Gemm_Rocblas_1140853073,0.0900787
GemmTunableOp_float_TN,tn_384_380_1536,Gemm_Rocblas_1140853156,0.0432579
GemmTunableOp_float_TN,tn_384_6656_1536,Gemm_Rocblas_1140853036,0.313732
GemmTunableOp_float_TN,tn_384_780_1536,Gemm_Rocblas_1140853157,0.0666053
GemmTunableOp_float_TN,tn_1536_116_384,Gemm_Rocblas_1140853307,0.0173621
GemmTunableOp_float_TN,tn_384_520_1536,Gemm_Rocblas_1140853170,0.0585121
GemmTunableOp_float_TN,tn_1536_364_384,Gemm_Rocblas_1140853108,0.0287422
GemmTunableOp_float_TN,tn_384_45_1536,Gemm_Rocblas_1140853266,0.0229206
GemmTunableOp_float_TN,tn_384_660_1536,Gemm_Rocblas_1140853098,0.0646305
GemmTunableOp_float_TN,tn_384_7968_1536,Default,0.346609
GemmTunableOp_float_TN,tn_1536_456_384,Gemm_Rocblas_1140853284,0.0309059
GemmTunableOp_float_TN,tn_384_332_384,Gemm_Rocblas_1140853316,0.0156433
GemmTunableOp_float_TN,tn_384_80_384,Gemm_Rocblas_1140853197,0.0128653
GemmTunableOp_float_TN,tn_1536_488_384,Gemm_Rocblas_1140853284,0.0314278
GemmTunableOp_float_TN,tn_1536_108_384,Gemm_Rocblas_1140853320,0.0173857
GemmTunableOp_float_TN,tn_384_256_384,Gemm_Rocblas_1140853317,0.0164297
GemmTunableOp_float_TN,tn_384_652_1536,Gemm_Rocblas_1140853170,0.0601637
GemmTunableOp_float_TN,tn_384_116_1536,Gemm_Rocblas_1140853257,0.024851
GemmTunableOp_float_TN,tn_1536_616_384,Gemm_Rocblas_1140853045,0.0402767
GemmTunableOp_float_TN,tn_1536_8_384,Gemm_Rocblas_1140853253,0.0151445
GemmTunableOp_float_TN,tn_384_528_384,Gemm_Rocblas_1140853312,0.0204466
GemmTunableOp_float_TN,tn_1536_92_384,Gemm_Rocblas_1140853309,0.0161125
GemmTunableOp_float_TN,tn_384_28_1536,Gemm_Rocblas_1140853266,0.0185341
GemmTunableOp_float_TN,tn_384_724_384,Gemm_Rocblas_1140853120,0.0209014
GemmTunableOp_float_TN,tn_384_616_384,Gemm_Rocblas_1140853316,0.020545
GemmTunableOp_float_TN,tn_384_6912_384,Gemm_Rocblas_1140853073,0.0907095
GemmTunableOp_float_TN,tn_384_664_1536,Gemm_Rocblas_1140853174,0.0614567
GemmTunableOp_float_TN,tn_384_260_1536,Gemm_Rocblas_1140853170,0.0387535
GemmTunableOp_float_TN,tn_384_592_384,Gemm_Rocblas_1140853119,0.0206202
GemmTunableOp_float_TN,tn_384_812_384,Gemm_Rocblas_1140853100,0.021903
GemmTunableOp_float_TN,tn_384_184_1536,Gemm_Rocblas_1140853191,0.0295098
GemmTunableOp_float_TN,tn_1536_780_384,Gemm_Rocblas_1140853047,0.0511668
GemmTunableOp_float_TN,tn_1536_208_384,Gemm_Rocblas_1140853322,0.0218886
GemmTunableOp_float_TN,tn_384_588_384,Gemm_Rocblas_1140853316,0.0205766
GemmTunableOp_float_TN,tn_384_228_1536,Gemm_Rocblas_1140853265,0.034393
GemmTunableOp_float_TN,tn_384_736_384,Gemm_Rocblas_1140853098,0.0209466
GemmTunableOp_float_TN,tn_384_452_1536,Gemm_Rocblas_1140853108,0.046696
GemmTunableOp_float_TN,tn_384_228_384,Gemm_Rocblas_1140853308,0.0149605
GemmTunableOp_float_TN,tn_384_7104_1536,Gemm_Rocblas_1140853036,0.345094
GemmTunableOp_float_TN,tn_1536_6880_384,Default,0.310096
GemmTunableOp_float_TN,tn_384_916_384,Gemm_Rocblas_1140853100,0.0216502
GemmTunableOp_float_TN,tn_1536_808_384,Gemm_Rocblas_1140853066,0.0526368
GemmTunableOp_float_TN,tn_384_16_1536,Gemm_Rocblas_1140853253,0.0180821
GemmTunableOp_float_TN,tn_384_28_384,Gemm_Rocblas_1140853260,0.0116317
GemmTunableOp_float_TN,tn_1536_840_384,Gemm_Rocblas_1140853073,0.0532764
GemmTunableOp_float_TN,tn_1536_76_384,Gemm_Rocblas_1140853309,0.0160005
GemmTunableOp_float_TN,tn_1536_900_384,Gemm_Rocblas_1140853030,0.0549753
GemmTunableOp_float_TN,tn_384_6656_384,Gemm_Rocblas_1140853064,0.0913021
GemmTunableOp_float_TN,tn_384_156_384,Gemm_Rocblas_1140853097,0.0146197
GemmTunableOp_float_TN,tn_384_95_1536,Gemm_Rocblas_1140853191,0.0255406
GemmTunableOp_float_TN,tn_384_596_384,Gemm_Rocblas_1140853316,0.0205733
GemmTunableOp_float_TN,tn_1536_196_384,Gemm_Rocblas_1140853145,0.021835
GemmTunableOp_float_TN,tn_384_424_384,Gemm_Rocblas_1140853306,0.017169
GemmTunableOp_float_TN,tn_384_124_1536,Gemm_Rocblas_1140853257,0.0251578
GemmTunableOp_float_TN,tn_1536_5984_384,Gemm_Rocblas_1140853290,0.280225
GemmTunableOp_float_TN,tn_384_136_384,Gemm_Rocblas_1140853197,0.0147737
GemmTunableOp_float_TN,tn_1536_272_384,Gemm_Rocblas_1140853108,0.0279782
GemmTunableOp_float_TN,tn_384_160_384,Gemm_Rocblas_1140853097,0.0142357
GemmTunableOp_float_TN,tn_384_10_384,Gemm_Rocblas_1140853253,0.0126769
GemmTunableOp_float_TN,tn_384_95_384,Gemm_Rocblas_1140853197,0.0128289
GemmTunableOp_float_TN,tn_1536_7840_384,Default,0.343764
GemmTunableOp_float_TN,tn_384_8128_1536,Gemm_Rocblas_1140853079,0.358682
GemmTunableOp_float_TN,tn_384_216_1536,Gemm_Rocblas_1140853265,0.0344719
GemmTunableOp_float_TN,tn_384_424_1536,Gemm_Rocblas_1140853182,0.0464176
GemmTunableOp_float_TN,tn_384_348_1536,Gemm_Rocblas_1140853316,0.0429963
GemmTunableOp_float_TN,tn_384_732_384,Gemm_Rocblas_1140853120,0.020897
GemmTunableOp_float_TN,tn_384_52_384,Gemm_Rocblas_1140853260,0.0128085
GemmTunableOp_float_TN,tn_1536_632_384,Gemm_Rocblas_1140853028,0.0448624
GemmTunableOp_float_TN,tn_384_6_1536,Gemm_Rocblas_1140853250,0.0200338
GemmTunableOp_float_TN,tn_384_496_384,Gemm_Rocblas_1140853119,0.0173793
GemmTunableOp_float_TN,tn_384_768_1536,Gemm_Rocblas_1140853098,0.0654157
GemmTunableOp_float_TN,tn_384_104_384,Gemm_Rocblas_1140853303,0.0157341
GemmTunableOp_float_TN,tn_384_612_1536,Gemm_Rocblas_1140853156,0.0637941
GemmTunableOp_float_TN,tn_384_400_1536,Gemm_Rocblas_1140853108,0.0463051
GemmTunableOp_float_TN,tn_384_544_1536,Gemm_Rocblas_1140853170,0.0581257
GemmTunableOp_float_TN,tn_384_488_384,Gemm_Rocblas_1140853306,0.0171289
GemmTunableOp_float_TN,tn_384_340_1536,Gemm_Rocblas_1140853170,0.0422503
GemmTunableOp_float_TN,tn_384_1004_1536,Gemm_Rocblas_1140853157,0.0702461
GemmTunableOp_float_TN,tn_384_368_1536,Gemm_Rocblas_1140853156,0.0432131
GemmTunableOp_float_TN,tn_1536_252_384,Gemm_Rocblas_1140853100,0.0225929
GemmTunableOp_float_TN,tn_384_68_384,Gemm_Rocblas_1140853197,0.0128481
GemmTunableOp_float_TN,tn_384_244_384,Gemm_Rocblas_1140853156,0.0150777
GemmTunableOp_float_TN,tn_384_296_384,Gemm_Rocblas_1140853097,0.0158717
GemmTunableOp_float_TN,tn_384_8128_384,Gemm_Rocblas_1140853046,0.101449
GemmTunableOp_float_TN,tn_384_840_1536,Gemm_Rocblas_1140853108,0.0673381
GemmTunableOp_float_TN,tn_384_564_384,Gemm_Rocblas_1140853316,0.0205914
GemmTunableOp_float_TN,tn_384_120_384,Gemm_Rocblas_1140853230,0.0137277
GemmTunableOp_float_TN,tn_1536_344_384,Gemm_Rocblas_1140853145,0.0280074
GemmTunableOp_float_TN,tn_1536_324_384,Gemm_Rocblas_1140853122,0.028137
GemmTunableOp_float_TN,tn_1536_7072_384,Default,0.305648
GemmTunableOp_float_TN,tn_384_6752_1536,Gemm_Rocblas_1140853053,0.315979
GemmTunableOp_float_TN,tn_384_308_1536,Gemm_Rocblas_1140853181,0.0404871
GemmTunableOp_float_TN,tn_384_6880_384,Gemm_Rocblas_1140853073,0.0948148
GemmTunableOp_float_TN,tn_384_7040_1536,Gemm_Rocblas_1140853036,0.320643
GemmTunableOp_float_TN,tn_384_592_1536,Gemm_Rocblas_1140853097,0.0634081
GemmTunableOp_float_TN,tn_384_8192_384,Gemm_Rocblas_1140853058,0.0999176
GemmTunableOp_float_TN,tn_384_724_1536,Gemm_Rocblas_1140853120,0.0658625
GemmTunableOp_float_TN,tn_1536_48_384,Gemm_Rocblas_1140853325,0.0154861
GemmTunableOp_float_TN,tn_1536_256_384,Gemm_Rocblas_1140853157,0.022459
GemmTunableOp_float_TN,tn_384_220_384,Gemm_Rocblas_1140853308,0.0149597
GemmTunableOp_float_TN,tn_384_528_1536,Gemm_Rocblas_1140853170,0.0607849
GemmTunableOp_float_TN,tn_1536_7936_384,Default,0.335943
GemmTunableOp_float_TN,tn_384_6848_384,Gemm_Rocblas_1140853330,0.0932599
GemmTunableOp_float_TN,tn_384_572_1536,Gemm_Rocblas_1140853142,0.0635577
GemmTunableOp_float_TN,tn_1536_320_384,Gemm_Rocblas_1140853157,0.0275626
GemmTunableOp_float_TN,tn_384_292_384,Gemm_Rocblas_1140853316,0.0158489
GemmTunableOp_float_TN,tn_384_168_384,Gemm_Rocblas_1140853142,0.0146797
GemmTunableOp_float_TN,tn_384_6912_1536,Gemm_Rocblas_1140853036,0.322992
GemmTunableOp_float_TN,tn_1536_740_384,Gemm_Rocblas_1140853028,0.0458848
GemmTunableOp_float_TN,tn_384_1024_1536,Gemm_Rocblas_1140853130,0.0693253
GemmTunableOp_float_TN,tn_384_4_384,Gemm_Rocblas_1140853255,0.0129545
GemmTunableOp_float_TN,tn_384_716_1536,Gemm_Rocblas_1140853108,0.066797
GemmTunableOp_float_TN,tn_384_192_1536,Gemm_Rocblas_1140853191,0.0300691
GemmTunableOp_float_TN,tn_384_960_1536,Gemm_Rocblas_1140853157,0.0689689
GemmTunableOp_float_TN,tn_384_8160_1536,Gemm_Rocblas_1140853060,0.357685
GemmTunableOp_float_TN,tn_384_788_1536,Gemm_Rocblas_1140853157,0.0661765
GemmTunableOp_float_TN,tn_1536_120_384,Gemm_Rocblas_1140853307,0.0174217
GemmTunableOp_float_TN,tn_384_14_384,Gemm_Rocblas_1140853253,0.0116345
GemmTunableOp_float_TN,tn_384_7744_384,Gemm_Rocblas_1140853048,0.099466
GemmTunableOp_float_TN,tn_384_508_1536,Gemm_Rocblas_1140853156,0.0503052
GemmTunableOp_float_TN,tn_1536_1012_384,Gemm_Rocblas_1140853047,0.0571588
GemmTunableOp_float_TN,tn_384_496_1536,Gemm_Rocblas_1140853156,0.0501784
GemmTunableOp_float_TN,tn_1536_672_384,Gemm_Rocblas_1140853101,0.0451552
GemmTunableOp_float_TN,tn_1536_7328_384,Gemm_Rocblas_1140853290,0.345716
GemmTunableOp_float_TN,tn_384_70_1536,Gemm_Rocblas_1140853173,0.0275523
GemmTunableOp_float_TN,tn_384_316_1536,Gemm_Rocblas_1140853191,0.0406231
GemmTunableOp_float_TN,tn_384_208_1536,Gemm_Rocblas_1140853248,0.0342338
GemmTunableOp_float_TN,tn_384_708_1536,Gemm_Rocblas_1140853098,0.0659345
GemmTunableOp_float_TN,tn_1536_7744_384,Gemm_Rocblas_1140853331,0.36737
GemmTunableOp_float_TN,tn_1536_6656_384,Gemm_Rocblas_1140853331,0.295469
GemmTunableOp_float_TN,tn_384_76_384,Gemm_Rocblas_1140853197,0.0128129
GemmTunableOp_float_TN,tn_384_252_1536,Gemm_Rocblas_1140853265,0.0347326
GemmTunableOp_float_TN,tn_1536_416_384,Gemm_Rocblas_1140853064,0.0298163
GemmTunableOp_float_TN,tn_384_60_1536,Gemm_Rocblas_1140853171,0.0224913
GemmTunableOp_float_TN,tn_384_148_384,Gemm_Rocblas_1140853197,0.0147609
GemmTunableOp_float_TN,tn_1536_95_384,Gemm_Rocblas_1140853309,0.0160845
GemmTunableOp_float_TN,tn_384_120_1536,Gemm_Rocblas_1140853257,0.0249226
GemmTunableOp_float_TN,tn_384_284_384,Gemm_Rocblas_1140853097,0.0160949
GemmTunableOp_float_TN,tn_384_936_1536,Gemm_Rocblas_1140853108,0.069023
GemmTunableOp_float_TN,tn_1536_7680_384,Gemm_Rocblas_1140853331,0.346358
GemmTunableOp_float_TN,tn_384_580_1536,Gemm_Rocblas_1140853174,0.0587025
GemmTunableOp_float_TN,tn_384_8064_1536,Default,0.349026
GemmTunableOp_float_TN,tn_1536_136_384,Gemm_Rocblas_1140853097,0.0204361
GemmTunableOp_float_TN,tn_1536_8064_384,Default,0.342357
GemmTunableOp_float_TN,tn_1536_296_384,Gemm_Rocblas_1140853157,0.0280366
GemmTunableOp_float_TN,tn_384_960_384,Gemm_Rocblas_1140853157,0.0214374
GemmTunableOp_float_TN,tn_1536_284_384,Gemm_Rocblas_1140853157,0.0279462
GemmTunableOp_float_TN,tn_384_6784_1536,Gemm_Rocblas_1140853036,0.312073
GemmTunableOp_float_TN,tn_1536_6272_384,Gemm_Rocblas_1140853331,0.290608
GemmTunableOp_float_TN,tn_384_140_384,Gemm_Rocblas_1140853197,0.0147537
GemmTunableOp_float_TN,tn_1536_724_384,Gemm_Rocblas_1140853028,0.0460315
GemmTunableOp_float_TN,tn_384_72_384,Gemm_Rocblas_1140853197,0.0127785
GemmTunableOp_float_TN,tn_384_88_384,Gemm_Rocblas_1140853197,0.0130237
GemmTunableOp_float_TN,tn_384_8160_384,Gemm_Rocblas_1140853046,0.102837
GemmTunableOp_float_TN,tn_384_372_1536,Gemm_Rocblas_1140853097,0.0431475
GemmTunableOp_float_TN,tn_1536_45_384,Gemm_Rocblas_1140853314,0.0176666
GemmTunableOp_float_TN,tn_1536_104_384,Gemm_Rocblas_1140853307,0.0180465
GemmTunableOp_float_TN,tn_1536_228_384,Gemm_Rocblas_1140853100,0.0221214
GemmTunableOp_float_TN,tn_1536_68_384,Gemm_Rocblas_1140853309,0.0161285
GemmTunableOp_float_TN,tn_384_916_1536,Gemm_Rocblas_1140853157,0.0684733
GemmTunableOp_float_TN,tn_1536_688_384,Gemm_Rocblas_1140853028,0.0460908
GemmTunableOp_float_TN,tn_384_7072_1536,Gemm_Rocblas_1140853036,0.324898
GemmTunableOp_float_TN,tn_1536_428_384,Gemm_Rocblas_1140853064,0.0306379
GemmTunableOp_float_TN,tn_384_284_1536,Gemm_Rocblas_1140853181,0.0399322
GemmTunableOp_float_TN,tn_384_60_384,Gemm_Rocblas_1140853260,0.0129585
GemmTunableOp_float_TN,tn_384_6464_1536,Gemm_Rocblas_1140853036,0.331061
GemmTunableOp_float_TN,tn_384_612_384,Gemm_Rocblas_1140853316,0.0205966
GemmTunableOp_float_TN,tn_1536_7424_384,Gemm_Rocblas_1140853331,0.342638
GemmTunableOp_float_TN,tn_384_160_1536,Gemm_Rocblas_1140853181,0.0299823
GemmTunableOp_float_TN,tn_384_556_1536,Gemm_Rocblas_1140853189,0.0631309
GemmTunableOp_float_TN,tn_384_6048_384,Gemm_Rocblas_1140853038,0.0825364
GemmTunableOp_float_TN,tn_384_7712_1536,Default,0.361954
GemmTunableOp_float_TN,tn_1536_588_384,Gemm_Rocblas_1140853073,0.0432203
GemmTunableOp_float_TN,tn_384_688_384,Gemm_Rocblas_1140853120,0.0210354
GemmTunableOp_float_TN,tn_384_8_384,Gemm_Rocblas_1140853249,0.0129929
GemmTunableOp_float_TN,tn_1536_664_384,Gemm_Rocblas_1140853053,0.0402238
GemmTunableOp_float_TN,tn_1536_96_384,Gemm_Rocblas_1140853309,0.0156381
GemmTunableOp_float_TN,tn_384_88_1536,Gemm_Rocblas_1140853191,0.0242841
GemmTunableOp_float_TN,tn_1536_776_384,Gemm_Rocblas_1140853038,0.0506432
GemmTunableOp_float_TN,tn_1536_960_384,Gemm_Rocblas_1140853045,0.05392
GemmTunableOp_float_TN,tn_384_40_384,Gemm_Rocblas_1140853249,0.0127049
GemmTunableOp_float_TN,tn_1536_14_384,Gemm_Rocblas_1140853253,0.0142473
GemmTunableOp_float_TN,tn_1536_916_384,Gemm_Rocblas_1140853075,0.0550412
GemmTunableOp_float_TN,tn_384_40_1536,Gemm_Rocblas_1140853171,0.0222217
GemmTunableOp_float_TN,tn_384_1_384,Gemm_Rocblas_1140853264,0.0128569
GemmTunableOp_float_TN,tn_384_7808_1536,Default,0.362865
GemmTunableOp_float_TN,tn_384_536_1536,Gemm_Rocblas_1140853170,0.05703
GemmTunableOp_float_TN,tn_384_512_1536,Gemm_Rocblas_1140853156,0.0500272
GemmTunableOp_float_TN,tn_1536_7616_384,Gemm_Rocblas_1140853029,0.351099
GemmTunableOp_float_TN,tn_1536_9_384,Gemm_Rocblas_1140853253,0.0152573
GemmTunableOp_float_TN,tn_1536_704_384,Gemm_Rocblas_1140853028,0.0438771
GemmTunableOp_float_TN,tn_1536_6208_384,Gemm_Rocblas_1140853331,0.296295
GemmTunableOp_float_TN,tn_384_6496_1536,Gemm_Rocblas_1140853036,0.334212
GemmTunableOp_float_TN,tn_384_108_1536,Gemm_Rocblas_1140853257,0.0248442
GemmTunableOp_float_TN,tn_384_248_1536,Gemm_Rocblas_1140853189,0.0314319
GemmTunableOp_float_TN,tn_384_624_1536,Gemm_Rocblas_1140853156,0.0634697
GemmTunableOp_float_TN,tn_1536_6816_384,Gemm_Rocblas_1140853290,0.307206
GemmTunableOp_float_TN,tn_1536_820_384,Gemm_Rocblas_1140853066,0.0525828
GemmTunableOp_float_TN,tn_384_252_384,Gemm_Rocblas_1140853308,0.0151989
GemmTunableOp_float_TN,tn_384_7_384,Gemm_Rocblas_1140853249,0.0129437
GemmTunableOp_float_TN,tn_384_7296_1536,Default,0.355737
GemmTunableOp_float_TN,tn_384_5984_1536,Gemm_Rocblas_1140853328,0.262038
GemmTunableOp_float_TN,tn_1536_7360_384,Gemm_Rocblas_1140853331,0.345731
GemmTunableOp_float_TN,tn_384_6848_1536,Gemm_Rocblas_1140853036,0.316145
GemmTunableOp_float_TN,tn_1536_5664_384,Gemm_Rocblas_1140853290,0.273409
GemmTunableOp_float_TN,tn_1536_7488_384,Gemm_Rocblas_1140853331,0.348508
GemmTunableOp_float_TN,tn_384_7872_1536,Default,0.344528
GemmTunableOp_float_TN,tn_1536_4_384,Gemm_Rocblas_1140853253,0.0151025
GemmTunableOp_float_TN,tn_1536_356_384,Gemm_Rocblas_1140853108,0.0284402
GemmTunableOp_float_TN,tn_1536_1004_384,Gemm_Rocblas_1140853047,0.0574036
GemmTunableOp_float_TN,tn_384_6432_384,Gemm_Rocblas_1140853073,0.0907815
GemmTunableOp_float_TN,tn_384_1024_384,Gemm_Rocblas_1140853130,0.021421
GemmTunableOp_float_TN,tn_384_384_1536,Gemm_Rocblas_1140853097,0.0430799
GemmTunableOp_float_TN,tn_1536_6912_384,Default,0.301894
GemmTunableOp_float_TN,tn_384_6_384,Gemm_Rocblas_1140853249,0.0129801
GemmTunableOp_float_TN,tn_384_1012_384,Gemm_Rocblas_1140853157,0.0219402
GemmTunableOp_float_TN,tn_1536_860_384,Gemm_Rocblas_1140853038,0.05319
GemmTunableOp_float_TN,tn_384_664_384,Gemm_Rocblas_1140853098,0.0208617
GemmTunableOp_float_TN,tn_384_4928_1536,Gemm_Rocblas_1140853036,0.231136
GemmTunableOp_float_TN,tn_384_32_384,Gemm_Rocblas_1140853260,0.0116217
GemmTunableOp_float_TN,tn_1536_10_384,Gemm_Rocblas_1140853253,0.0152189
GemmTunableOp_float_TN,tn_1536_6848_384,Gemm_Rocblas_1140853290,0.305461
GemmTunableOp_float_TN,tn_384_1004_384,Gemm_Rocblas_1140853157,0.0218926
GemmTunableOp_float_TN,tn_384_808_384,Gemm_Rocblas_1140853322,0.0219586
GemmTunableOp_float_TN,tn_1536_496_384,Gemm_Rocblas_1140853284,0.0312346
GemmTunableOp_float_TN,tn_1536_168_384,Gemm_Rocblas_1140853120,0.0207594
GemmTunableOp_float_TN,tn_384_128_384,Gemm_Rocblas_1140853303,0.0136769
GemmTunableOp_float_TN,tn_384_232_384,Gemm_Rocblas_1140853308,0.0151025
GemmTunableOp_float_TN,tn_384_7328_384,Gemm_Rocblas_1140853046,0.099318
GemmTunableOp_float_TN,tn_1536_80_384,Gemm_Rocblas_1140853309,0.0160389
GemmTunableOp_float_TN,tn_1536_460_384,Gemm_Rocblas_1140853284,0.0307535
GemmTunableOp_float_TN,tn_384_11_1536,Gemm_Rocblas_1140853253,0.0179157
GemmTunableOp_float_TN,tn_384_48_384,Gemm_Rocblas_1140853249,0.0127681
GemmTunableOp_float_TN,tn_1536_312_384,Gemm_Rocblas_1140853157,0.0281586
GemmTunableOp_float_TN,tn_1536_6336_384,Gemm_Rocblas_1140853029,0.296649
GemmTunableOp_float_TN,tn_384_18_1536,Gemm_Rocblas_1140853253,0.0216482
GemmTunableOp_float_TN,tn_384_380_384,Gemm_Rocblas_1140853316,0.0157505
GemmTunableOp_float_TN,tn_1536_520_384,Gemm_Rocblas_1140853036,0.0408003
GemmTunableOp_float_TN,tn_384_7904_384,Gemm_Rocblas_1140853047,0.102261
GemmTunableOp_float_TN,tn_384_6176_384,Gemm_Rocblas_1140853036,0.0918588
GemmTunableOp_float_TN,tn_384_8000_1536,Default,0.348588
GemmTunableOp_float_TN,tn_1536_52_384,Gemm_Rocblas_1140853151,0.0155209
GemmTunableOp_float_TN,tn_384_216_384,Gemm_Rocblas_1140853119,0.0149329
GemmTunableOp_float_TN,tn_384_2_1536,Gemm_Rocblas_1140853253,0.0208542
GemmTunableOp_float_TN,tn_384_6976_384,Gemm_Rocblas_1140853064,0.0929703
GemmTunableOp_float_TN,tn_384_572_384,Gemm_Rocblas_1140853316,0.020559
GemmTunableOp_float_TN,tn_384_752_384,Gemm_Rocblas_1140853098,0.0211662
GemmTunableOp_float_TN,tn_1536_512_384,Gemm_Rocblas_1140853284,0.0307062
GemmTunableOp_float_TN,tn_1536_548_384,Gemm_Rocblas_1140853028,0.0424623
GemmTunableOp_float_TN,tn_384_560_1536,Gemm_Rocblas_1140853170,0.0622377
GemmTunableOp_float_TN,tn_384_5_1536,Gemm_Rocblas_1140853250,0.020033
GemmTunableOp_float_TN,tn_1536_412_384,Gemm_Rocblas_1140853066,0.0298238
GemmTunableOp_float_TN,tn_1536_7168_384,Gemm_Rocblas_1140853331,0.323353
GemmTunableOp_float_TN,tn_384_668_1536,Gemm_Rocblas_1140853098,0.0649681
GemmTunableOp_float_TN,tn_384_6880_1536,Gemm_Rocblas_1140853036,0.322991
GemmTunableOp_float_TN,tn_1536_696_384,Gemm_Rocblas_1140853028,0.0460388
GemmTunableOp_float_TN,tn_384_752_1536,Gemm_Rocblas_1140853143,0.0661733
GemmTunableOp_float_TN,tn_384_276_1536,Gemm_Rocblas_1140853169,0.0367787
GemmTunableOp_float_TN,tn_1536_7872_384,Default,0.342371
GemmTunableOp_float_TN,tn_384_7040_384,Gemm_Rocblas_1140853064,0.0931116
GemmTunableOp_float_TN,tn_384_14_1536,Gemm_Rocblas_1140853253,0.0180993
GemmTunableOp_float_TN,tn_1536_612_384,Gemm_Rocblas_1140853101,0.0439668
GemmTunableOp_float_TN,tn_1536_556_384,Gemm_Rocblas_1140853028,0.0427319
GemmTunableOp_float_TN,tn_384_536_384,Gemm_Rocblas_1140853316,0.0203626
GemmTunableOp_float_TN,tn_384_364_1536,Gemm_Rocblas_1140853097,0.0432348
GemmTunableOp_float_TN,tn_1536_7520_384,Gemm_Rocblas_1140853331,0.350623
GemmTunableOp_float_TN,tn_384_704_384,Gemm_Rocblas_1140853098,0.0202918
GemmTunableOp_float_TN,tn_384_320_1536,Gemm_Rocblas_1140853170,0.0417886
GemmTunableOp_float_TN,tn_384_7392_384,Gemm_Rocblas_1140853047,0.098436
GemmTunableOp_float_TN,tn_384_660_384,Gemm_Rocblas_1140853120,0.0208318
GemmTunableOp_float_TN,tn_1536_500_384,Gemm_Rocblas_1140853073,0.0308546
GemmTunableOp_float_TN,tn_1536_6752_384,Default,0.30524
GemmTunableOp_float_TN,tn_384_504_384,Gemm_Rocblas_1140853119,0.0173765
GemmTunableOp_float_TN,tn_384_744_384,Gemm_Rocblas_1140853120,0.021221
GemmTunableOp_float_TN,tn_384_300_1536,Gemm_Rocblas_1140853191,0.0401543
GemmTunableOp_float_TN,tn_1536_6528_384,Gemm_Rocblas_1140853290,0.294978
GemmTunableOp_float_TN,tn_384_7648_384,Gemm_Rocblas_1140853048,0.0984732
GemmTunableOp_float_TN,tn_384_968_1536,Gemm_Rocblas_1140853108,0.0702058
GemmTunableOp_float_TN,tn_384_6112_384,Gemm_Rocblas_1140853284,0.0849071
GemmTunableOp_float_TN,tn_1536_788_384,Gemm_Rocblas_1140853047,0.0510128
GemmTunableOp_float_TN,tn_384_6816_1536,Gemm_Rocblas_1140853036,0.325614
GemmTunableOp_float_TN,tn_1536_6944_384,Default,0.306724
GemmTunableOp_float_TN,tn_1536_11_384,Gemm_Rocblas_1140853253,0.0141661
GemmTunableOp_float_TN,tn_384_620_1536,Gemm_Rocblas_1140853174,0.0610805
GemmTunableOp_float_TN,tn_384_500_1536,Gemm_Rocblas_1140853180,0.0495248
GemmTunableOp_float_TN,tn_384_448_384,Gemm_Rocblas_1140853157,0.0167953
GemmTunableOp_float_TN,tn_384_376_1536,Gemm_Rocblas_1140853097,0.0433059
GemmTunableOp_float_TN,tn_384_636_1536,Gemm_Rocblas_1140853119,0.0635721
GemmTunableOp_float_TN,tn_384_6432_1536,Gemm_Rocblas_1140853036,0.336841
GemmTunableOp_float_TN,tn_384_324_1536,Gemm_Rocblas_1140853170,0.0426159
GemmTunableOp_float_TN,tn_1536_516_384,Gemm_Rocblas_1140853036,0.0401643
GemmTunableOp_float_TN,tn_384_72_1536,Gemm_Rocblas_1140853171,0.0235574
GemmTunableOp_float_TN,tn_1536_160_384,Gemm_Rocblas_1140853316,0.0200378
GemmTunableOp_float_TN,tn_1536_752_384,Gemm_Rocblas_1140853028,0.0455412
GemmTunableOp_float_TN,tn_384_328_384,Gemm_Rocblas_1140853316,0.0156445
GemmTunableOp_float_TN,tn_1536_7104_384,Gemm_Rocblas_1140853290,0.325276
GemmTunableOp_float_TN,tn_384_7968_384,Gemm_Rocblas_1140853047,0.100231
GemmTunableOp_float_TN,tn_384_768_384,Gemm_Rocblas_1140853120,0.020309
GemmTunableOp_float_TN,tn_384_696_384,Gemm_Rocblas_1140853120,0.0211218
GemmTunableOp_float_TN,tn_384_6368_1536,Gemm_Rocblas_1140853036,0.334612
GemmTunableOp_float_TN,tn_384_76_1536,Gemm_Rocblas_1140853191,0.025569
GemmTunableOp_float_TN,tn_384_692_1536,Gemm_Rocblas_1140853098,0.0657813
GemmTunableOp_float_TN,tn_1536_148_384,Gemm_Rocblas_1140853316,0.0203438
GemmTunableOp_float_TN,tn_1536_936_384,Gemm_Rocblas_1140853064,0.0557344
GemmTunableOp_float_TN,tn_384_7200_384,Gemm_Rocblas_1140853048,0.0986704
GemmTunableOp_float_TN,tn_1536_596_384,Gemm_Rocblas_1140853045,0.0402863
GemmTunableOp_float_TN,tn_384_112_384,Gemm_Rocblas_1140853215,0.0136425
GemmTunableOp_float_TN,tn_384_816_1536,Gemm_Rocblas_1140853157,0.0662373
GemmTunableOp_float_TN,tn_384_196_384,Gemm_Rocblas_1140853316,0.0147149
GemmTunableOp_float_TN,tn_384_8032_1536,Default,0.350342
GemmTunableOp_float_TN,tn_384_7008_1536,Gemm_Rocblas_1140853036,0.326204
GemmTunableOp_float_TN,tn_384_564_1536,Gemm_Rocblas_1140853097,0.0631073
GemmTunableOp_float_TN,tn_1536_44_384,Gemm_Rocblas_1140853324,0.0152645
GemmTunableOp_float_TN,tn_384_44_1536,Gemm_Rocblas_1140853266,0.0222282
GemmTunableOp_float_TN,tn_1536_328_384,Gemm_Rocblas_1140853108,0.0280642
GemmTunableOp_float_TN,tn_384_364_384,Gemm_Rocblas_1140853097,0.0157689
GemmTunableOp_float_TN,tn_384_656_1536,Gemm_Rocblas_1140853120,0.0649805
GemmTunableOp_float_TN,tn_384_6784_384,Gemm_Rocblas_1140853284,0.0913027
GemmTunableOp_float_TN,tn_384_8032_384,Gemm_Rocblas_1140853048,0.101541
GemmTunableOp_float_TN,tn_384_852_384,Gemm_Rocblas_1140853157,0.0216438
GemmTunableOp_float_TN,tn_1536_7456_384,Gemm_Rocblas_1140853331,0.347701
GemmTunableOp_float_TN,tn_384_428_384,Gemm_Rocblas_1140853306,0.0171509
GemmTunableOp_float_TN,tn_384_484_1536,Gemm_Rocblas_1140853156,0.050082
GemmTunableOp_float_TN,tn_384_976_1536,Gemm_Rocblas_1140853157,0.0704626
GemmTunableOp_float_TN,tn_384_464_384,Gemm_Rocblas_1140853306,0.0172481
GemmTunableOp_float_TN,tn_384_580_384,Gemm_Rocblas_1140853316,0.0205086
GemmTunableOp_float_TN,tn_384_532_384,Gemm_Rocblas_1140853311,0.020463
GemmTunableOp_float_TN,tn_384_8064_384,Gemm_Rocblas_1140853046,0.100026
GemmTunableOp_float_TN,tn_384_156_1536,Gemm_Rocblas_1140853181,0.029955
GemmTunableOp_float_TN,tn_1536_384_384,Gemm_Rocblas_1140853108,0.027757
GemmTunableOp_float_TN,tn_1536_6304_384,Default,0.281966
GemmTunableOp_float_TN,tn_384_332_1536,Gemm_Rocblas_1140853170,0.0420387
GemmTunableOp_float_TN,tn_1536_8096_384,Default,0.346248
GemmTunableOp_float_TN,tn_1536_300_384,Gemm_Rocblas_1140853145,0.0281738
GemmTunableOp_float_TN,tn_384_7872_384,Gemm_Rocblas_1140853045,0.0995712
GemmTunableOp_float_TN,tn_384_7904_1536,Default,0.35
GemmTunableOp_float_TN,tn_1536_584_384,Gemm_Rocblas_1140853036,0.0418772
GemmTunableOp_float_TN,tn_384_6688_384,Gemm_Rocblas_1140853064,0.0909304
GemmTunableOp_float_TN,tn_384_10_1536,Gemm_Rocblas_1140853250,0.0202386
GemmTunableOp_float_TN,tn_384_632_1536,Gemm_Rocblas_1140853097,0.0636845
GemmTunableOp_float_TN,tn_384_144_1536,Gemm_Rocblas_1140853191,0.0294942
GemmTunableOp_float_TN,tn_384_548_384,Gemm_Rocblas_1140853316,0.0204358
GemmTunableOp_float_TN,tn_1536_304_384,Gemm_Rocblas_1140853145,0.0281838
GemmTunableOp_float_TN,tn_384_12_1536,Gemm_Rocblas_1140853253,0.0188907
GemmTunableOp_float_TN,tn_384_80_1536,Gemm_Rocblas_1140853181,0.025479
GemmTunableOp_float_TN,tn_1536_368_384,Gemm_Rocblas_1140853108,0.0287074
GemmTunableOp_float_TN,tn_384_312_384,Gemm_Rocblas_1140853097,0.0158697
GemmTunableOp_float_TN,tn_1536_332_384,Gemm_Rocblas_1140853108,0.0281942
GemmTunableOp_float_TN,tn_1536_468_384,Gemm_Rocblas_1140853284,0.030677
GemmTunableOp_float_TN,tn_384_900_384,Gemm_Rocblas_1140853100,0.0216946
GemmTunableOp_float_TN,tn_384_268_1536,Gemm_Rocblas_1140853181,0.0390707
GemmTunableOp_float_TN,tn_384_7456_1536,Default,0.358389
GemmTunableOp_float_TN,tn_1536_112_384,Gemm_Rocblas_1140853307,0.0173342
GemmTunableOp_float_TN,tn_384_336_384,Gemm_Rocblas_1140853316,0.0157377
GemmTunableOp_float_TN,tn_384_112_1536,Gemm_Rocblas_1140853257,0.0248946
GemmTunableOp_float_TN,tn_1536_188_384,Gemm_Rocblas_1140853143,0.0209746
GemmTunableOp_float_TN,tn_384_460_384,Gemm_Rocblas_1140853306,0.0172185
GemmTunableOp_float_TN,tn_384_360_1536,Gemm_Rocblas_1140853180,0.0401631
GemmTunableOp_float_TN,tn_1536_504_384,Gemm_Rocblas_1140853073,0.0309038
GemmTunableOp_float_TN,tn_384_7488_1536,Default,0.35778
GemmTunableOp_float_TN,tn_1536_472_384,Gemm_Rocblas_1140853073,0.0296542
GemmTunableOp_float_TN,tn_384_456_1536,Gemm_Rocblas_1140853104,0.0487088
GemmTunableOp_float_TN,tn_1536_8128_384,Default,0.347599
GemmTunableOp_float_TN,tn_384_492_1536,Gemm_Rocblas_1140853157,0.0491196
GemmTunableOp_float_TN,tn_384_716_384,Gemm_Rocblas_1140853120,0.0209118
GemmTunableOp_float_TN,tn_384_56_384,Gemm_Rocblas_1140853260,0.0125889
GemmTunableOp_float_TN,tn_1536_532_384,Gemm_Rocblas_1140853036,0.042318
GemmTunableOp_float_TN,tn_384_7552_1536,Gemm_Rocblas_1140853074,0.363077
GemmTunableOp_float_TN,tn_1536_200_384,Gemm_Rocblas_1140853100,0.0217542
GemmTunableOp_float_TN,tn_384_18_384,Gemm_Rocblas_1140853262,0.0125637
GemmTunableOp_float_TN,tn_384_432_384,Gemm_Rocblas_1140853306,0.0172673
GemmTunableOp_float_TN,tn_384_7136_1536,Gemm_Rocblas_1140853036,0.346611
GemmTunableOp_float_TN,tn_384_432_1536,Gemm_Rocblas_1140853182,0.0475532
GemmTunableOp_float_TN,tn_1536_388_384,Gemm_Rocblas_1140853066,0.0294362
GemmTunableOp_float_TN,tn_384_7296_384,Gemm_Rocblas_1140853046,0.0954332
GemmTunableOp_float_TN,tn_384_6688_1536,Gemm_Rocblas_1140853053,0.315832
GemmTunableOp_float_TN,tn_384_820_1536,Gemm_Rocblas_1140853108,0.067529
GemmTunableOp_float_TN,tn_1536_952_384,Gemm_Rocblas_1140853038,0.0556356
GemmTunableOp_float_TN,tn_384_352_1536,Gemm_Rocblas_1140853097,0.0428831
GemmTunableOp_float_TN,tn_384_6720_384,Gemm_Rocblas_1140853064,0.0892331
GemmTunableOp_float_TN,tn_384_416_1536,Gemm_Rocblas_1140853157,0.0469748
GemmTunableOp_float_TN,tn_1536_72_384,Gemm_Rocblas_1140853309,0.0159705
GemmTunableOp_float_TN,tn_384_388_1536,Gemm_Rocblas_1140853182,0.0456584
GemmTunableOp_float_TN,tn_1536_656_384,Gemm_Rocblas_1140853028,0.0448236
GemmTunableOp_float_TN,tn_1536_660_384,Gemm_Rocblas_1140853028,0.0454252
GemmTunableOp_float_TN,tn_384_700_384,Gemm_Rocblas_1140853098,0.021145
GemmTunableOp_float_TN,tn_384_868_384,Gemm_Rocblas_1140853100,0.0217314
GemmTunableOp_float_TN,tn_384_552_1536,Gemm_Rocblas_1140853170,0.0616493
GemmTunableOp_float_TN,tn_1536_204_384,Gemm_Rocblas_1140853100,0.0217754
GemmTunableOp_float_TN,tn_1536_544_384,Gemm_Rocblas_1140853036,0.0417515
GemmTunableOp_float_TN,tn_384_268_384,Gemm_Rocblas_1140853316,0.0158537
GemmTunableOp_float_TN,tn_384_7936_384,Gemm_Rocblas_1140853046,0.0981112
GemmTunableOp_float_TN,tn_384_440_384,Gemm_Rocblas_1140853306,0.0172329
GemmTunableOp_float_TN,tn_384_6208_1536,Gemm_Rocblas_1140853036,0.334503
GemmTunableOp_float_TN,tn_384_392_1536,Gemm_Rocblas_1140853108,0.0459532
GemmTunableOp_float_TN,tn_384_708_384,Gemm_Rocblas_1140853120,0.0209558
GemmTunableOp_float_TN,tn_1536_292_384,Gemm_Rocblas_1140853157,0.028097
GemmTunableOp_float_TN,tn_384_304_384,Gemm_Rocblas_1140853097,0.0159133
GemmTunableOp_float_TN,tn_384_196_1536,Gemm_Rocblas_1140853248,0.0340947
GemmTunableOp_float_TN,tn_1536_8032_384,Default,0.344027
GemmTunableOp_float_TN,tn_384_540_384,Gemm_Rocblas_1140853316,0.0204177
GemmTunableOp_float_TN,tn_384_596_1536,Gemm_Rocblas_1140853174,0.0594173
GemmTunableOp_float_TN,tn_384_44_384,Gemm_Rocblas_1140853260,0.0124229
GemmTunableOp_float_TN,tn_384_468_1536,Gemm_Rocblas_1140853126,0.0491072
GemmTunableOp_float_TN,tn_1536_376_384,Gemm_Rocblas_1140853108,0.0287138
GemmTunableOp_float_TN,tn_384_860_384,Gemm_Rocblas_1140853157,0.0216618
GemmTunableOp_float_TN,tn_384_6208_384,Gemm_Rocblas_1140853330,0.0892167
GemmTunableOp_float_TN,tn_384_164_1536,Gemm_Rocblas_1140853181,0.0300183
GemmTunableOp_float_TN,tn_384_7776_1536,Default,0.362028
GemmTunableOp_float_TN,tn_384_416_384,Gemm_Rocblas_1140853320,0.0169305
GemmTunableOp_float_TN,tn_384_440_1536,Gemm_Rocblas_1140853180,0.0448484
GemmTunableOp_float_TN,tn_384_652_384,Gemm_Rocblas_1140853098,0.0208418
GemmTunableOp_float_TN,tn_384_264_1536,Gemm_Rocblas_1140853169,0.0363939
GemmTunableOp_float_TN,tn_384_532_1536,Gemm_Rocblas_1140853172,0.0608073
GemmTunableOp_float_TN,tn_384_396_384,Gemm_Rocblas_1140853306,0.0170365
GemmTunableOp_float_TN,tn_1536_6784_384,Default,0.296249
GemmTunableOp_float_TN,tn_384_148_1536,Gemm_Rocblas_1140853191,0.0297158
GemmTunableOp_float_TN,tn_1536_7264_384,Gemm_Rocblas_1140853331,0.343983
GemmTunableOp_float_TN,tn_384_4928_384,Gemm_Rocblas_1140853064,0.0608633
GemmTunableOp_float_TN,tn_1536_7136_384,Gemm_Rocblas_1140853290,0.326265
GemmTunableOp_float_TN,tn_1536_216_384,Gemm_Rocblas_1140853145,0.0220886
GemmTunableOp_float_TN,tn_1536_552_384,Gemm_Rocblas_1140853036,0.0426948
GemmTunableOp_float_TN,tn_384_816_384,Gemm_Rocblas_1140853322,0.0219286
GemmTunableOp_float_TN,tn_1536_7648_384,Gemm_Rocblas_1140853331,0.350774
GemmTunableOp_float_TN,tn_384_304_1536,Gemm_Rocblas_1140853191,0.0404419
GemmTunableOp_float_TN,tn_384_5984_384,Gemm_Rocblas_1140853328,0.0787066
GemmTunableOp_float_TN,tn_384_860_1536,Gemm_Rocblas_1140853108,0.067529
GemmTunableOp_float_TN,tn_1536_736_384,Gemm_Rocblas_1140853028,0.0468144
GemmTunableOp_float_TN,tn_384_92_1536,Gemm_Rocblas_1140853181,0.0257842
GemmTunableOp_float_TN,tn_1536_172_384,Gemm_Rocblas_1140853143,0.0208382
GemmTunableOp_float_TN,tn_384_420_384,Gemm_Rocblas_1140853307,0.0177625
GemmTunableOp_float_TN,tn_384_5216_384,Gemm_Rocblas_1140853328,0.0723858
GemmTunableOp_float_TN,tn_384_608_384,Gemm_Rocblas_1140853308,0.0201898
GemmTunableOp_float_TN,tn_384_308_384,Gemm_Rocblas_1140853316,0.0158789
GemmTunableOp_float_TN,tn_384_340_384,Gemm_Rocblas_1140853316,0.0156189
GemmTunableOp_float_TN,tn_384_524_1536,Gemm_Rocblas_1140853170,0.0582393
GemmTunableOp_float_TN,tn_384_168_1536,Gemm_Rocblas_1140853191,0.0300246
GemmTunableOp_float_TN,tn_384_96_384,Gemm_Rocblas_1140853197,0.0128457
GemmTunableOp_float_TN,tn_1536_608_384,Gemm_Rocblas_1140853101,0.0442932
GemmTunableOp_float_TN,tn_1536_6560_384,Gemm_Rocblas_1140853290,0.301492
GemmTunableOp_float_TN,tn_384_388_384,Gemm_Rocblas_1140853306,0.0170921
GemmTunableOp_float_TN,tn_1536_680_384,Gemm_Rocblas_1140853064,0.0406979
GemmTunableOp_float_TN,tn_384_868_1536,Gemm_Rocblas_1140853108,0.0672849
GemmTunableOp_float_TN,tn_1536_6368_384,Gemm_Rocblas_1140853290,0.297925
GemmTunableOp_float_TN,tn_384_11_384,Gemm_Rocblas_1140853253,0.0118949
GemmTunableOp_float_TN,tn_1536_692_384,Gemm_Rocblas_1140853101,0.0459215
GemmTunableOp_float_TN,tn_384_204_1536,Gemm_Rocblas_1140853248,0.0342779
GemmTunableOp_float_TN,tn_384_512_384,Gemm_Rocblas_1140853119,0.0170785
GemmTunableOp_float_TN,tn_384_776_1536,Gemm_Rocblas_1140853157,0.0660598
GemmTunableOp_float_TN,tn_1536_140_384,Gemm_Rocblas_1140853316,0.020373
GemmTunableOp_float_TN,tn_1536_264_384,Gemm_Rocblas_1140853122,0.0279898
GemmTunableOp_float_TN,tn_1536_144_384,Gemm_Rocblas_1140853097,0.0204417
GemmTunableOp_float_TN,tn_1536_640_384,Gemm_Rocblas_1140853053,0.0381879
GemmTunableOp_float_TN,tn_384_480_1536,Gemm_Rocblas_1140853156,0.049724
GemmTunableOp_float_TN,tn_384_640_1536,Gemm_Rocblas_1140853170,0.0600561
GemmTunableOp_float_TN,tn_384_36_1536,Gemm_Rocblas_1140853171,0.0218166
GemmTunableOp_float_TN,tn_384_560_384,Gemm_Rocblas_1140853316,0.0205146
GemmTunableOp_float_TN,tn_384_480_384,Gemm_Rocblas_1140853306,0.0168993
GemmTunableOp_float_TN,tn_384_6624_1536,Gemm_Rocblas_1140853036,0.312335
GemmTunableOp_float_TN,tn_384_804_384,Gemm_Rocblas_1140853100,0.0218514
GemmTunableOp_float_TN,tn_384_56_1536,Gemm_Rocblas_1140853171,0.0225686
GemmTunableOp_float_TN,tn_384_7680_1536,Default,0.356178
GemmTunableOp_float_TN,tn_1536_7968_384,Default,0.348234
GemmTunableOp_float_TN,tn_1536_804_384,Gemm_Rocblas_1140853038,0.051116
GemmTunableOp_float_TN,tn_1536_192_384,Gemm_Rocblas_1140853120,0.0201114
GemmTunableOp_float_TN,tn_1536_524_384,Gemm_Rocblas_1140853123,0.0419911
GemmTunableOp_float_TN,tn_384_368_384,Gemm_Rocblas_1140853097,0.0156973
GemmTunableOp_float_TN,tn_384_952_1536,Gemm_Rocblas_1140853130,0.0692338
GemmTunableOp_float_TN,tn_1536_424_384,Gemm_Rocblas_1140853066,0.0297947
GemmTunableOp_float_TN,tn_384_6944_1536,Gemm_Rocblas_1140853109,0.330068
GemmTunableOp_float_TN,tn_384_5664_384,Gemm_Rocblas_1140853328,0.076461
GemmTunableOp_float_TN,tn_384_356_384,Gemm_Rocblas_1140853316,0.0157109
GemmTunableOp_float_TN,tn_384_464_1536,Gemm_Rocblas_1140853130,0.048952
GemmTunableOp_float_TN,tn_384_476_384,Gemm_Rocblas_1140853119,0.0172305
GemmTunableOp_float_TN,tn_384_276_384,Gemm_Rocblas_1140853316,0.0158537
GemmTunableOp_float_TN,tn_384_400_384,Gemm_Rocblas_1140853306,0.0171421
GemmTunableOp_float_TN,tn_384_736_1536,Gemm_Rocblas_1140853108,0.0665469
GemmTunableOp_float_TN,tn_1536_420_384,Gemm_Rocblas_1140853133,0.0340483
GemmTunableOp_float_TN,tn_384_6816_384,Gemm_Rocblas_1140853073,0.0908051
GemmTunableOp_float_TN,tn_1536_276_384,Gemm_Rocblas_1140853100,0.0279602
GemmTunableOp_float_TN,tn_384_7072_384,Gemm_Rocblas_1140853036,0.0946916
GemmTunableOp_float_TN,tn_1536_816_384,Gemm_Rocblas_1140853038,0.0515464
GemmTunableOp_float_TN,tn_384_124_384,Gemm_Rocblas_1140853230,0.0137917
GemmTunableOp_float_TN,tn_384_728_384,Gemm_Rocblas_1140853098,0.020909
GemmTunableOp_float_TN,tn_384_6336_1536,Gemm_Rocblas_1140853053,0.333723
GemmTunableOp_float_TN,tn_384_316_384,Gemm_Rocblas_1140853097,0.0159233
GemmTunableOp_float_TN,tn_384_116_384,Gemm_Rocblas_1140853230,0.0137021
GemmTunableOp_float_TN,tn_384_472_1536,Gemm_Rocblas_1140853157,0.0495448
GemmTunableOp_float_TN,tn_384_6464_384,Gemm_Rocblas_1140853330,0.0914319
GemmTunableOp_float_TN,tn_384_632_384,Gemm_Rocblas_1140853316,0.0205666
GemmTunableOp_float_TN,tn_384_264_384,Gemm_Rocblas_1140853097,0.0158129
GemmTunableOp_float_TN,tn_1536_5216_384,Gemm_Rocblas_1140853292,0.246074
GemmTunableOp_float_TN,tn_384_164_384,Gemm_Rocblas_1140853142,0.0146553
GemmTunableOp_float_TN,tn_1536_6432_384,Gemm_Rocblas_1140853290,0.299903
GemmTunableOp_float_TN,tn_1536_6592_384,Gemm_Rocblas_1140853290,0.301867
GemmTunableOp_float_TN,tn_384_524_384,Gemm_Rocblas_1140853097,0.0204494
GemmTunableOp_float_TN,tn_384_456_384,Gemm_Rocblas_1140853306,0.0171957
GemmTunableOp_float_TN,tn_1536_18_384,Gemm_Rocblas_1140853303,0.0166421
GemmTunableOp_float_TN,tn_1536_716_384,Gemm_Rocblas_1140853028,0.0458812
GemmTunableOp_float_TN,tn_384_8096_1536,Gemm_Rocblas_1140853328,0.351811
GemmTunableOp_float_TN,tn_1536_124_384,Gemm_Rocblas_1140853097,0.0174873
GemmTunableOp_float_TN,tn_1536_240_384,Default,0.0223026
GemmTunableOp_float_TN,tn_384_900_1536,Gemm_Rocblas_1140853108,0.068503
GemmTunableOp_float_TN,tn_384_404_1536,Gemm_Rocblas_1140853174,0.0461424
GemmTunableOp_float_TN,tn_384_324_384,Gemm_Rocblas_1140853316,0.0156709
GemmTunableOp_float_TN,tn_384_656_384,Gemm_Rocblas_1140853120,0.0209226
GemmTunableOp_float_TN,tn_1536_7584_384,Gemm_Rocblas_1140853046,0.352587
GemmTunableOp_float_TN,tn_384_140_1536,Gemm_Rocblas_1140853191,0.0297182
GemmTunableOp_float_TN,tn_384_292_1536,Gemm_Rocblas_1140853191,0.0402643
GemmTunableOp_float_TN,tn_384_7584_1536,Default,0.359765
GemmTunableOp_float_TN,tn_384_476_1536,Gemm_Rocblas_1140853156,0.0499008
GemmTunableOp_float_NN,nn_1000_1000_1000,Gemm_Rocblas_1140854470,0.0947245
